{
  "metadata": {
    "symbol": "sh601988",
    "decision_date_t": "2026-09-03",
    "window_years": 2,
    "requested_start_date": "2024-09-03",
    "first_trading_date": "2024-09-03",
    "latest_trading_date": "2026-09-02",
    "t_minus_1_trading_date": "2026-09-02",
    "trading_day_count": 484,
    "price_adjustment": "qfq/forward-adjusted close",
    "small_drawdown_pct": 3.0,
    "short_gap_days": 5,
    "weight_definition": "trough_index - peak_index",
    "price_cutoff_rule": "trading_date < decision_date_t",
    "source": "https://web.ifzq.gtimg.cn/appstock/app/fqkline/get",
    "generated_at": "2026-09-03T11:18:57+08:00"
  },
  "metrics": {
    "raw_event_count": 24,
    "included_event_count": 12,
    "excluded_event_count": 12,
    "arithmetic_mean_drawdown_pct": 6.9124670691855234,
    "trading_day_weighted_mean_drawdown_pct": 9.610610299590553,
    "total_trading_day_weight": 212,
    "maximum_drawdown_pct": 15.023087071240116
  },
  "buy_references": {
    "highest_close_through_t_minus_1": 6.68,
    "highest_close_date": "2026-09-02",
    "arithmetic_mean_reference_price": 6.218247199778407,
    "trading_day_weighted_reference_price": 6.038011231987351,
    "buy_commission_pct": 0.01,
    "transfer_fee_pct": 0.001,
    "sell_stamp_duty_pct": 0.05,
    "buy_friction_pct": 0.011,
    "sell_friction_pct": 0.061,
    "round_trip_friction_pct": 0.072,
    "expected_dividend_yield_pct": 3.0,
    "expected_capital_gain_pct": 12.0,
    "expected_total_net_return_pct": 15.0,
    "dividend_and_capital_gain_are_net": true,
    "sell_cost_separately_reserved": false,
    "price_tick": 0.01,
    "arithmetic_friction_adjusted": {
      "theoretical_entry_price": 6.217563267818947,
      "entry_limit_price": 6.21,
      "all_in_cost_at_entry_limit": 6.210683100000001,
      "theoretical_exit_price": 6.96021080058836,
      "exit_limit_price": 6.97,
      "net_capital_gain_pct_at_exit_limit": 12.157522575898284,
      "net_total_return_pct_including_dividend": 15.157522575898284
    },
    "weighted_friction_adjusted": {
      "theoretical_entry_price": 6.037347123803732,
      "entry_limit_price": 6.03,
      "all_in_cost_at_entry_limit": 6.0306633000000005,
      "theoretical_exit_price": 6.758465559991596,
      "exit_limit_price": 6.76,
      "net_capital_gain_pct_at_exit_limit": 12.025428446651954,
      "net_total_return_pct_including_dividend": 15.025428446651954
    },
    "commission_minimum_included": false
  },
  "matrix": {
    "short_small": 12,
    "short_large": 5,
    "long_small": 0,
    "long_large": 7
  },
  "ongoing_drawdown": null,
  "events": [
    {
      "event_id": 1,
      "peak_date": "2024-09-03",
      "peak_price": 4.291,
      "trough_date": "2024-09-09",
      "trough_price": 4.211,
      "drawdown_pct": 1.8643672803542288,
      "peak_to_trough_trading_days": 4,
      "recovery_date": "2024-09-10",
      "included_in_averages": false,
      "exclusion_reason": "drawdown<3.00% and gap<=5 trading days"
    },
    {
      "event_id": 2,
      "peak_date": "2024-09-10",
      "peak_price": 4.331,
      "trough_date": "2024-09-13",
      "trough_price": 4.111,
      "drawdown_pct": 5.0796582775340715,
      "peak_to_trough_trading_days": 3,
      "recovery_date": "2024-09-24",
      "included_in_averages": true,
      "exclusion_reason": ""
    },
    {
      "event_id": 3,
      "peak_date": "2024-09-26",
      "peak_price": 4.521,
      "trough_date": "2024-09-27",
      "trough_price": 4.401,
      "drawdown_pct": 2.654280026542799,
      "peak_to_trough_trading_days": 1,
      "recovery_date": "2024-09-30",
      "included_in_averages": false,
      "exclusion_reason": "drawdown<3.00% and gap<=5 trading days"
    },
    {
      "event_id": 4,
      "peak_date": "2024-09-30",
      "peak_price": 4.531,
      "trough_date": "2024-10-09",
      "trough_price": 4.341,
      "drawdown_pct": 4.193334804678872,
      "peak_to_trough_trading_days": 2,
      "recovery_date": "2024-10-10",
      "included_in_averages": true,
      "exclusion_reason": ""
    },
    {
      "event_id": 5,
      "peak_date": "2024-10-14",
      "peak_price": 4.671,
      "trough_date": "2024-11-12",
      "trough_price": 4.321,
      "drawdown_pct": 7.49304217512311,
      "peak_to_trough_trading_days": 21,
      "recovery_date": "2024-12-09",
      "included_in_averages": true,
      "exclusion_reason": ""
    },
    {
      "event_id": 6,
      "peak_date": "2024-12-10",
      "peak_price": 4.741,
      "trough_date": "2024-12-11",
      "trough_price": 4.661,
      "drawdown_pct": 1.6874077198903215,
      "peak_to_trough_trading_days": 1,
      "recovery_date": "2024-12-16",
      "included_in_averages": false,
      "exclusion_reason": "drawdown<3.00% and gap<=5 trading days"
    },
    {
      "event_id": 7,
      "peak_date": "2024-12-18",
      "peak_price": 4.811,
      "trough_date": "2024-12-19",
      "trough_price": 4.761,
      "drawdown_pct": 1.0392849719393027,
      "peak_to_trough_trading_days": 1,
      "recovery_date": "2024-12-23",
      "included_in_averages": false,
      "exclusion_reason": "drawdown<3.00% and gap<=5 trading days"
    },
    {
      "event_id": 8,
      "peak_date": "2024-12-25",
      "peak_price": 5.041,
      "trough_date": "2024-12-27",
      "trough_price": 5.011,
      "drawdown_pct": 0.5951200158698766,
      "peak_to_trough_trading_days": 2,
      "recovery_date": "2024-12-30",
      "included_in_averages": false,
      "exclusion_reason": "drawdown<3.00% and gap<=5 trading days"
    },
    {
      "event_id": 9,
      "peak_date": "2024-12-30",
      "peak_price": 5.061,
      "trough_date": "2025-01-22",
      "trough_price": 4.841,
      "drawdown_pct": 4.3469670025686575,
      "peak_to_trough_trading_days": 16,
      "recovery_date": "2025-01-27",
      "included_in_averages": true,
      "exclusion_reason": ""
    },
    {
      "event_id": 10,
      "peak_date": "2025-01-27",
      "peak_price": 5.102,
      "trough_date": "2025-02-10",
      "trough_price": 4.922,
      "drawdown_pct": 3.52802822422581,
      "peak_to_trough_trading_days": 4,
      "recovery_date": "2025-02-18",
      "included_in_averages": true,
      "exclusion_reason": ""
    },
    {
      "event_id": 11,
      "peak_date": "2025-02-18",
      "peak_price": 5.212,
      "trough_date": "2025-03-12",
      "trough_price": 4.982,
      "drawdown_pct": 4.412893323100531,
      "peak_to_trough_trading_days": 16,
      "recovery_date": "2025-03-31",
      "included_in_averages": true,
      "exclusion_reason": ""
    },
    {
      "event_id": 12,
      "peak_date": "2025-03-31",
      "peak_price": 5.252,
      "trough_date": "2025-04-01",
      "trough_price": 5.172,
      "drawdown_pct": 1.5232292460015229,
      "peak_to_trough_trading_days": 1,
      "recovery_date": "2025-04-03",
      "included_in_averages": false,
      "exclusion_reason": "drawdown<3.00% and gap<=5 trading days"
    },
    {
      "event_id": 13,
      "peak_date": "2025-04-03",
      "peak_price": 5.312,
      "trough_date": "2025-04-10",
      "trough_price": 5.032,
      "drawdown_pct": 5.2710843373493965,
      "peak_to_trough_trading_days": 4,
      "recovery_date": "2025-04-16",
      "included_in_averages": true,
      "exclusion_reason": ""
    },
    {
      "event_id": 14,
      "peak_date": "2025-04-18",
      "peak_price": 5.332,
      "trough_date": "2025-04-21",
      "trough_price": 5.282,
      "drawdown_pct": 0.9377344336083948,
      "peak_to_trough_trading_days": 1,
      "recovery_date": "2025-04-22",
      "included_in_averages": false,
      "exclusion_reason": "drawdown<3.00% and gap<=5 trading days"
    },
    {
      "event_id": 15,
      "peak_date": "2025-04-22",
      "peak_price": 5.382,
      "trough_date": "2025-04-23",
      "trough_price": 5.362,
      "drawdown_pct": 0.371609067261236,
      "peak_to_trough_trading_days": 1,
      "recovery_date": "2025-04-24",
      "included_in_averages": false,
      "exclusion_reason": "drawdown<3.00% and gap<=5 trading days"
    },
    {
      "event_id": 16,
      "peak_date": "2025-04-24",
      "peak_price": 5.482,
      "trough_date": "2025-04-25",
      "trough_price": 5.434,
      "drawdown_pct": 0.8755928493250686,
      "peak_to_trough_trading_days": 1,
      "recovery_date": "2025-04-28",
      "included_in_averages": false,
      "exclusion_reason": "drawdown<3.00% and gap<=5 trading days"
    },
    {
      "event_id": 17,
      "peak_date": "2025-04-28",
      "peak_price": 5.484,
      "trough_date": "2025-06-13",
      "trough_price": 5.114,
      "drawdown_pct": 6.746900072939466,
      "peak_to_trough_trading_days": 30,
      "recovery_date": "2025-06-24",
      "included_in_averages": true,
      "exclusion_reason": ""
    },
    {
      "event_id": 18,
      "peak_date": "2025-06-26",
      "peak_price": 5.574,
      "trough_date": "2025-06-27",
      "trough_price": 5.374,
      "drawdown_pct": 3.588087549336205,
      "peak_to_trough_trading_days": 1,
      "recovery_date": "2025-07-10",
      "included_in_averages": true,
      "exclusion_reason": ""
    },
    {
      "event_id": 19,
      "peak_date": "2025-07-10",
      "peak_price": 5.594,
      "trough_date": "2025-09-30",
      "trough_price": 4.954,
      "drawdown_pct": 11.44082946013587,
      "peak_to_trough_trading_days": 58,
      "recovery_date": "2025-11-14",
      "included_in_averages": true,
      "exclusion_reason": ""
    },
    {
      "event_id": 20,
      "peak_date": "2025-11-14",
      "peak_price": 5.594,
      "trough_date": "2025-11-17",
      "trough_price": 5.544,
      "drawdown_pct": 0.8938148015731229,
      "peak_to_trough_trading_days": 1,
      "recovery_date": "2025-11-19",
      "included_in_averages": false,
      "exclusion_reason": "drawdown<3.00% and gap<=5 trading days"
    },
    {
      "event_id": 21,
      "peak_date": "2025-11-21",
      "peak_price": 6.064,
      "trough_date": "2026-01-23",